{
  "$schema": "https://json-schema.org/draft/2020-12/schema",
  "$id": "https://github.com/nlecarosg/curia_datos/blob/main/esquema/observacion.schema.json",
  "title": "Observación",
  "description": "Una medición oficial ya contrastada con el cuerpo crudo de su fuente. La copia de referencia del esquema común también vive en curia_maxima; antes de encender la actualización automática hay que comprobar que ambas digan lo mismo.",
  "type": "object",
  "additionalProperties": true,
  "required": [
    "valor",
    "unidad",
    "fuente",
    "fecha_dato",
    "fecha_captura",
    "hash_crudo",
    "estado"
  ],
  "properties": {
    "valor": {
      "type": "number",
      "description": "Cifra publicada por el organismo, tal como viene en el cuerpo crudo."
    },
    "unidad": {
      "type": "string",
      "minLength": 1
    },
    "fuente": {
      "type": "string",
      "minLength": 1,
      "description": "Organismo, operación estadística y dirección de donde se bajó el cuerpo."
    },
    "fecha_dato": {
      "type": "string",
      "pattern": "^[0-9]{4}-[0-9]{2}$",
      "description": "Mes al que corresponde la cifra, en formato AAAA-MM."
    },
    "fecha_captura": {
      "type": "string",
      "pattern": "^[0-9]{4}-[0-9]{2}-[0-9]{2}T[0-9]{2}:[0-9]{2}:[0-9]{2}Z$",
      "description": "Instante UTC en que se guardó el cuerpo crudo."
    },
    "hash_crudo": {
      "type": "string",
      "pattern": "^sha256:[0-9a-f]{64}$",
      "description": "SHA-256 del cuerpo crudo, con prefijo sha256:."
    },
    "estado": {
      "type": "string",
      "enum": ["vigente", "no actualizado"]
    },
    "nota": {
      "type": "string",
      "minLength": 1,
      "description": "Aviso del organismo, si vino en el cuerpo. Por ejemplo: Valor provisional."
    }
  }
}
