[
  {
    "valor": 98.01440075024684,
    "unidad": "índice (base promedio 2023=100)",
    "fuente": "Instituto Nacional de Estadísticas (INE), Encuesta Mensual de Remuneraciones y Costos Laborales, índice nominal de remuneraciones (base 2023=100), nacional, dataflow SDMX CL01:DF_IR2023(1.0), https://sdmx.ine.gob.cl/rest/data/CL01,DF_IR2023,1.0/all?format=csv",
    "fecha_dato": "2023-01",
    "fecha_captura": "2026-10-23T17:58:02Z",
    "hash_crudo": "sha256:298e313fd274956c14fd3235a768e998e4908c99526f4549518017639b811827",
    "estado": "vigente"
  },
  {
    "valor": 97.47019504090197,
    "unidad": "índice (base promedio 2023=100)",
    "fuente": "Instituto Nacional de Estadísticas (INE), Encuesta Mensual de Remuneraciones y Costos Laborales, índice nominal de remuneraciones (base 2023=100), nacional, dataflow SDMX CL01:DF_IR2023(1.0), https://sdmx.ine.gob.cl/rest/data/CL01,DF_IR2023,1.0/all?format=csv",
    "fecha_dato": "2023-02",
    "fecha_captura": "2026-10-23T17:58:02Z",
    "hash_crudo": "sha256:298e313fd274956c14fd3235a768e998e4908c99526f4549518017639b811827",
    "estado": "vigente"
  },
  {
    "valor": 98.06933099963857,
    "unidad": "índice (base promedio 2023=100)",
    "fuente": "Instituto Nacional de Estadísticas (INE), Encuesta Mensual de Remuneraciones y Costos Laborales, índice nominal de remuneraciones (base 2023=100), nacional, dataflow SDMX CL01:DF_IR2023(1.0), https://sdmx.ine.gob.cl/rest/data/CL01,DF_IR2023,1.0/all?format=csv",
    "fecha_dato": "2023-03",
    "fecha_captura": "2026-10-23T17:58:02Z",
    "hash_crudo": "sha256:298e313fd274956c14fd3235a768e998e4908c99526f4549518017639b811827",
    "estado": "vigente"
  },
  {
    "valor": 98.73438274582361,
    "unidad": "índice (base promedio 2023=100)",
    "fuente": "Instituto Nacional de Estadísticas (INE), Encuesta Mensual de Remuneraciones y Costos Laborales, índice nominal de remuneraciones (base 2023=100), nacional, dataflow SDMX CL01:DF_IR2023(1.0), https://sdmx.ine.gob.cl/rest/data/CL01,DF_IR2023,1.0/all?format=csv",
    "fecha_dato": "2023-04",
    "fecha_captura": "2026-10-23T17:58:02Z",
    "hash_crudo": "sha256:298e313fd274956c14fd3235a768e998e4908c99526f4549518017639b811827",
    "estado": "vigente"
  },
  {
    "valor": 98.94462096332445,
    "unidad": "índice (base promedio 2023=100)",
    "fuente": "Instituto Nacional de Estadísticas (INE), Encuesta Mensual de Remuneraciones y Costos Laborales, índice nominal de remuneraciones (base 2023=100), nacional, dataflow SDMX CL01:DF_IR2023(1.0), https://sdmx.ine.gob.cl/rest/data/CL01,DF_IR2023,1.0/all?format=csv",
    "fecha_dato": "2023-05",
    "fecha_captura": "2026-10-23T17:58:02Z",
    "hash_crudo": "sha256:298e313fd274956c14fd3235a768e998e4908c99526f4549518017639b811827",
    "estado": "vigente"
  },
  {
    "valor": 99.893747014074,
    "unidad": "índice (base promedio 2023=100)",
    "fuente": "Instituto Nacional de Estadísticas (INE), Encuesta Mensual de Remuneraciones y Costos Laborales, índice nominal de remuneraciones (base 2023=100), nacional, dataflow SDMX CL01:DF_IR2023(1.0), https://sdmx.ine.gob.cl/rest/data/CL01,DF_IR2023,1.0/all?format=csv",
    "fecha_dato": "2023-06",
    "fecha_captura": "2026-10-23T17:58:02Z",
    "hash_crudo": "sha256:298e313fd274956c14fd3235a768e998e4908c99526f4549518017639b811827",
    "estado": "vigente"
  },
  {
    "valor": 100.29359471812286,
    "unidad": "índice (base promedio 2023=100)",
    "fuente": "Instituto Nacional de Estadísticas (INE), Encuesta Mensual de Remuneraciones y Costos Laborales, índice nominal de remuneraciones (base 2023=100), nacional, dataflow SDMX CL01:DF_IR2023(1.0), https://sdmx.ine.gob.cl/rest/data/CL01,DF_IR2023,1.0/all?format=csv",
    "fecha_dato": "2023-07",
    "fecha_captura": "2026-10-23T17:58:02Z",
    "hash_crudo": "sha256:298e313fd274956c14fd3235a768e998e4908c99526f4549518017639b811827",
    "estado": "vigente"
  },
  {
    "valor": 100.34012496189403,
    "unidad": "índice (base promedio 2023=100)",
    "fuente": "Instituto Nacional de Estadísticas (INE), Encuesta Mensual de Remuneraciones y Costos Laborales, índice nominal de remuneraciones (base 2023=100), nacional, dataflow SDMX CL01:DF_IR2023(1.0), https://sdmx.ine.gob.cl/rest/data/CL01,DF_IR2023,1.0/all?format=csv",
    "fecha_dato": "2023-08",
    "fecha_captura": "2026-10-23T17:58:02Z",
    "hash_crudo": "sha256:298e313fd274956c14fd3235a768e998e4908c99526f4549518017639b811827",
    "estado": "vigente"
  },
  {
    "valor": 101.83301066174538,
    "unidad": "índice (base promedio 2023=100)",
    "fuente": "Instituto Nacional de Estadísticas (INE), Encuesta Mensual de Remuneraciones y Costos Laborales, índice nominal de remuneraciones (base 2023=100), nacional, dataflow SDMX CL01:DF_IR2023(1.0), https://sdmx.ine.gob.cl/rest/data/CL01,DF_IR2023,1.0/all?format=csv",
    "fecha_dato": "2023-09",
    "fecha_captura": "2026-10-23T17:58:02Z",
    "hash_crudo": "sha256:298e313fd274956c14fd3235a768e998e4908c99526f4549518017639b811827",
    "estado": "vigente"
  },
  {
    "valor": 101.52444440083028,
    "unidad": "índice (base promedio 2023=100)",
    "fuente": "Instituto Nacional de Estadísticas (INE), Encuesta Mensual de Remuneraciones y Costos Laborales, índice nominal de remuneraciones (base 2023=100), nacional, dataflow SDMX CL01:DF_IR2023(1.0), https://sdmx.ine.gob.cl/rest/data/CL01,DF_IR2023,1.0/all?format=csv",
    "fecha_dato": "2023-10",
    "fecha_captura": "2026-10-23T17:58:02Z",
    "hash_crudo": "sha256:298e313fd274956c14fd3235a768e998e4908c99526f4549518017639b811827",
    "estado": "vigente"
  },
  {
    "valor": 101.58213948043122,
    "unidad": "índice (base promedio 2023=100)",
    "fuente": "Instituto Nacional de Estadísticas (INE), Encuesta Mensual de Remuneraciones y Costos Laborales, índice nominal de remuneraciones (base 2023=100), nacional, dataflow SDMX CL01:DF_IR2023(1.0), https://sdmx.ine.gob.cl/rest/data/CL01,DF_IR2023,1.0/all?format=csv",
    "fecha_dato": "2023-11",
    "fecha_captura": "2026-10-23T17:58:02Z",
    "hash_crudo": "sha256:298e313fd274956c14fd3235a768e998e4908c99526f4549518017639b811827",
    "estado": "vigente"
  },
  {
    "valor": 103.30000826296691,
    "unidad": "índice (base promedio 2023=100)",
    "fuente": "Instituto Nacional de Estadísticas (INE), Encuesta Mensual de Remuneraciones y Costos Laborales, índice nominal de remuneraciones (base 2023=100), nacional, dataflow SDMX CL01:DF_IR2023(1.0), https://sdmx.ine.gob.cl/rest/data/CL01,DF_IR2023,1.0/all?format=csv",
    "fecha_dato": "2023-12",
    "fecha_captura": "2026-10-23T17:58:02Z",
    "hash_crudo": "sha256:298e313fd274956c14fd3235a768e998e4908c99526f4549518017639b811827",
    "estado": "vigente"
  },
  {
    "valor": 104.08044090638575,
    "unidad": "índice (base promedio 2023=100)",
    "fuente": "Instituto Nacional de Estadísticas (INE), Encuesta Mensual de Remuneraciones y Costos Laborales, índice nominal de remuneraciones (base 2023=100), nacional, dataflow SDMX CL01:DF_IR2023(1.0), https://sdmx.ine.gob.cl/rest/data/CL01,DF_IR2023,1.0/all?format=csv",
    "fecha_dato": "2024-01",
    "fecha_captura": "2026-10-23T17:58:02Z",
    "hash_crudo": "sha256:298e313fd274956c14fd3235a768e998e4908c99526f4549518017639b811827",
    "estado": "vigente"
  },
  {
    "valor": 6.188927453217774,
    "unidad": "variación a 12 meses (porcentaje)",
    "fuente": "Instituto Nacional de Estadísticas (INE), Encuesta Mensual de Remuneraciones y Costos Laborales, índice nominal de remuneraciones (base 2023=100), nacional, dataflow SDMX CL01:DF_IR2023(1.0), https://sdmx.ine.gob.cl/rest/data/CL01,DF_IR2023,1.0/all?format=csv",
    "fecha_dato": "2024-01",
    "fecha_captura": "2026-10-23T17:58:02Z",
    "hash_crudo": "sha256:298e313fd274956c14fd3235a768e998e4908c99526f4549518017639b811827",
    "estado": "vigente"
  },
  {
    "valor": 103.76761583573213,
    "unidad": "índice (base promedio 2023=100)",
    "fuente": "Instituto Nacional de Estadísticas (INE), Encuesta Mensual de Remuneraciones y Costos Laborales, índice nominal de remuneraciones (base 2023=100), nacional, dataflow SDMX CL01:DF_IR2023(1.0), https://sdmx.ine.gob.cl/rest/data/CL01,DF_IR2023,1.0/all?format=csv",
    "fecha_dato": "2024-02",
    "fecha_captura": "2026-10-23T17:58:02Z",
    "hash_crudo": "sha256:298e313fd274956c14fd3235a768e998e4908c99526f4549518017639b811827",
    "estado": "vigente"
  },
  {
    "valor": 6.460868157889221,
    "unidad": "variación a 12 meses (porcentaje)",
    "fuente": "Instituto Nacional de Estadísticas (INE), Encuesta Mensual de Remuneraciones y Costos Laborales, índice nominal de remuneraciones (base 2023=100), nacional, dataflow SDMX CL01:DF_IR2023(1.0), https://sdmx.ine.gob.cl/rest/data/CL01,DF_IR2023,1.0/all?format=csv",
    "fecha_dato": "2024-02",
    "fecha_captura": "2026-10-23T17:58:02Z",
    "hash_crudo": "sha256:298e313fd274956c14fd3235a768e998e4908c99526f4549518017639b811827",
    "estado": "vigente"
  },
  {
    "valor": 104.82437479968594,
    "unidad": "índice (base promedio 2023=100)",
    "fuente": "Instituto Nacional de Estadísticas (INE), Encuesta Mensual de Remuneraciones y Costos Laborales, índice nominal de remuneraciones (base 2023=100), nacional, dataflow SDMX CL01:DF_IR2023(1.0), https://sdmx.ine.gob.cl/rest/data/CL01,DF_IR2023,1.0/all?format=csv",
    "fecha_dato": "2024-03",
    "fecha_captura": "2026-10-23T17:58:02Z",
    "hash_crudo": "sha256:298e313fd274956c14fd3235a768e998e4908c99526f4549518017639b811827",
    "estado": "vigente"
  },
  {
    "valor": 6.888028837549909,
    "unidad": "variación a 12 meses (porcentaje)",
    "fuente": "Instituto Nacional de Estadísticas (INE), Encuesta Mensual de Remuneraciones y Costos Laborales, índice nominal de remuneraciones (base 2023=100), nacional, dataflow SDMX CL01:DF_IR2023(1.0), https://sdmx.ine.gob.cl/rest/data/CL01,DF_IR2023,1.0/all?format=csv",
    "fecha_dato": "2024-03",
    "fecha_captura": "2026-10-23T17:58:02Z",